### ISSUE TITLE
[MacOS] Gerbera is not broadcasting SSDP anouncements

### ISSUE THREAD

**Issue by St3ll4rM4n** [gerbera/gerbera#3596]
**Describe the bug**
Gerbera on MacOS is not broadcasting SSDP announcements, thus it's not discoverable by upnp clients on the network.

**To Reproduce**
Install gerbera using brew.

Configure to your needs using i.e. below lines for network.

>     <interface>en0</interface>
>     <port>49152</port>
> 

**Expected behavior**
Gerbera should be discoverable

**Server (please complete the following information):**
 - OS: OS: MacOS Sequoia 15.6.1 - 24.6.0 Darwin Kernel Version 24.6.0: Mon Jul 14 11:30:34 PDT 2025; root:xnu-11417.140.69~1/RELEASE_ARM64_T8103 arm64
 - Gerbera Version: 2.6.1
 - Versions of libraries: All default from brew
 - Source: brew

**Media client (please complete the following / remove not applicable:**
 - Device: Samsung TV
 - Client app: Internal samsung software

**Additional context**

I'm starting gerbera using following command

> sudo -u gerbera /opt/homebrew/bin/gerbera -c /opt/homebrew/etc/gerbera/config.xml -l /opt/homebrew/var/log/gerbera.log

Here is the log after starting:

> 2025-09-07 17:05:14   info: Gerbera UPnP Server 2.6.1 - https://gerbera.io/
> 2025-09-07 17:05:14   info: Copyright 2016-2025 Gerbera Contributors.
> 2025-09-07 17:05:14   info: Gerbera is free software, covered by the GNU General Public License version 2
> 2025-09-07 17:05:14   info: Loading configuration from: /opt/homebrew/etc/gerbera/config.xml
> 2025-09-07 17:05:14   info: Parsing configuration...
> 2025-09-07 17:05:14 warning: Error in configuration, could not find  command "vlc" in $PATH for '/config/attribute::command'
> 2025-09-07 17:05:14   info: Automatically added default BoxLayout key=Root, title=Root, objClass=object.container, enabled=true, size=1
> 2025-09-07 17:05:14   info: Automatically added default BoxLayout key=PCDirectory, title=PC Directory, objClass=object.container, enabled=true, size=1
> 2025-09-07 17:05:14   info: Configuration load succeeded.
> 2025-09-07 17:05:14   info: Validating configuration...
> 2025-09-07 17:05:14 warning: Box key=Trailer/trailerRoot, title=Online Services, objClass=object.container, enabled=true, size=1 will be ignored in built-in layout. Unknown Key 'Trailer/trailerRoot'
> 2025-09-07 17:05:14 warning: Box key=Trailer/appleTrailers, title=Apple Trailers, objClass=object.container, enabled=true, size=1 will be ignored in built-in layout. Unknown Key 'Trailer/appleTrailers'
> 2025-09-07 17:05:14 warning: Box key=Trailer/allTrailers, title=All Trailers, objClass=object.container, enabled=true, size=1 will be ignored in built-in layout. Unknown Key 'Trailer/allTrailers'
> 2025-09-07 17:05:14 warning: Box key=Trailer/allGenres, title=Genres, objClass=object.container, enabled=true, size=1 will be ignored in built-in layout. Unknown Key 'Trailer/allGenres'
> 2025-09-07 17:05:14 warning: Box key=Trailer/relDate, title=Release Date, objClass=object.container, enabled=true, size=1 will be ignored in built-in layout. Unknown Key 'Trailer/relDate'
> 2025-09-07 17:05:14 warning: Box key=Trailer/postDate, title=Post Date, objClass=object.container, enabled=true, size=1 will be ignored in built-in layout. Unknown Key 'Trailer/postDate'
> 2025-09-07 17:05:14 warning: Box key=Trailer/unknown, title=Unknown, objClass=object.container, enabled=true, size=1 will be ignored in built-in layout. Unknown Key 'Trailer/unknown'
> 2025-09-07 17:05:14   info: Configuration check succeeded.
> 2025-09-07 17:05:14   info: Loading 0 configuration items from database
> 2025-09-07 17:05:14   info: Initialising UPnP with interface: en0, port: 49152
> 2025-09-07 17:05:14   info: IPv4: Server bound to: 192.168.1.1:49152
> 2025-09-07 17:05:14   info: IPv6: Server bound to: fe80::8d9:73f8:d627:c726:49152
> 2025-09-07 17:05:14   info: IPv6 ULA/GLA: Server bound to: fdf9:b82e:519d:a34d:182d:bea1:6e91:2f72:49152
> 2025-09-07 17:05:14   info: The Web UI can be reached by following this link: http://192.168.1.1:49152

No 1900 port announcement are going out from gerbera. I can only see other clients in my network.

> admin@MyMacServer ~ % sudo tcpdump -i en0 udp port 1900 -n                    
> tcpdump: verbose output suppressed, use -v[v]... for full protocol decode
> listening on en0, link-type EN10MB (Ethernet), snapshot length 524288 bytes
> 17:06:29.054440 IP 192.168.1.153.50476 > 239.255.255.250.1900: UDP, length 125
> 17:07:00.962070 IP 192.168.1.11.44073 > 239.255.255.250.1900: UDP, length 601

HTTP server works properly as following command return content.
curl -s http://192.168.1.1:49152/description.xml
curl -s http://192.168.1.1:49152/upnp/description.xml

Gerbera listens on 1900

> admin@MyMacServer ~ % sudo lsof -nP -iUDP | grep 1900                 
> Password:
> gerbera   11764       _gerbera   13u  IPv4 0x4d8c06ef6f7a5c90      0t0  UDP *:1900
> gerbera   11764       _gerbera   14u  IPv6 0x44484069985adc3b      0t0  UDP *:1900
> gerbera   11764       _gerbera   15u  IPv6 0x4bfc575b182525f2      0t0  UDP *:1900

Because a lot of frustration and actually stuck in debuging I thought I'll try minidlna server from brew package.
And it worked properly with default configuration. It announces to my other upnp clients. So appears, it's something with gerbera specific. Maybe libupnp?

Any thoughts?

**Comment by KarlStraussberger** [comment]
That is definitely an UPNP issue, because we only init the services. SSDP only goes out in `alive` intervals. But there is also a SSDP Search request, clients are sending out which is triggering SSDP responses (all on udp-1900)

If minidlna works, it's no firewall topic.

LibUPnP has one drawback: It binds to interfaces not IPs, so if you have multiple interfaces (wireless, wired) which are bridged, gerbera may listen on the wrong interface. Did you try to change the port?

**Comment by St3ll4rM4n** [comment]
This is what I did and didn't help.

- Changed "alive" to 62.
- Changed `<port></>` to 49153, 62000, 2500
- Played with UID
- Generated completely default config file using --create-config

Here are additional information. I can't see en0 is bridged. en1 is suspisionus?

Any ideas how I can further debug and identify problem?

Listening ports:
```
> admin@MyMacServer ~ % sudo lsof -nP -iUDP -i -n| grep -I gerbera
> Password:
> gerbera   40717          _gerbera    8u  IPv4 0x4260ffcf5a8c4ac8      0t0    TCP 192.168.1.1:49152 (LISTEN)
> gerbera   40717          _gerbera    9u  IPv6 0x9c54d2da3d53b846      0t0    TCP [fe80:6::8d9:73f8:d627:c726]:49152 (LISTEN)
> gerbera   40717          _gerbera   10u  IPv6 0x612edb3c6db2e317      0t0    TCP [fdf9:b82e:519d:a34d:182d:bea1:6e91:2f72]:49152 (LISTEN)
> gerbera   40717          _gerbera   11u  IPv4 0x3416bfbb58577bc6      0t0    UDP 127.0.0.1:57506
> gerbera   40717          _gerbera   12u  IPv4 0x12ab9202af6516bc      0t0    UDP *:*
> gerbera   40717          _gerbera   13u  IPv6 0x4d8c06ef6f7a5c90      0t0    UDP *:*
> gerbera   40717          _gerbera   14u  IPv4 0x44484069985adc3b      0t0    UDP *:1900
> gerbera   40717          _gerbera   15u  IPv6 0x4bfc575b182525f2      0t0    UDP *:1900
> gerbera   40717          _gerbera   16u  IPv6 0x1502e40b74c13acf      0t0    UDP *:1900
```
Interfaces:
```
> admin@MyMacServer ~ % ifconfig            
> lo0: flags=8049<UP,LOOPBACK,RUNNING,MULTICAST> mtu 16384
> 	options=1203<RXCSUM,TXCSUM,TXSTATUS,SW_TIMESTAMP>
> 	inet 127.0.0.1 netmask 0xff000000
> 	inet6 ::1 prefixlen 128 
> 	inet6 fe80::1%lo0 prefixlen 64 scopeid 0x1 
> 	nd6 options=201<PERFORMNUD,DAD>
> gif0: flags=8010<POINTOPOINT,MULTICAST> mtu 1280
> stf0: flags=0<> mtu 1280
> anpi0: flags=8863<UP,BROADCAST,SMART,RUNNING,SIMPLEX,MULTICAST> mtu 1500
> 	options=400<CHANNEL_IO>
> 	ether 56:d4:87:cd:ea:7a
> 	media: none
> 	status: inactive
> anpi1: flags=8863<UP,BROADCAST,SMART,RUNNING,SIMPLEX,MULTICAST> mtu 1500
> 	options=400<CHANNEL_IO>
> 	ether 56:d4:87:cd:ea:7b
> 	media: none
> 	status: inactive
> en0: flags=8863<UP,BROADCAST,SMART,RUNNING,SIMPLEX,MULTICAST> mtu 1500
> 	options=50b<RXCSUM,TXCSUM,VLAN_HWTAGGING,AV,CHANNEL_IO>
> 	ether 14:98:77:48:c4:09
> 	inet6 fe80::8d9:73f8:d627:c726%en0 prefixlen 64 secured scopeid 0x6 
> 	inet6 fdf9:b82e:519d:a34d:182d:bea1:6e91:2f72 prefixlen 64 autoconf secured 
> 	inet 192.168.1.1 netmask 0xffffff00 broadcast 192.168.1.255
> 	nd6 options=201<PERFORMNUD,DAD>
> 	media: autoselect (1000baseT <full-duplex,flow-control,energy-efficient-ethernet>)
> 	status: active
> en4: flags=8863<UP,BROADCAST,SMART,RUNNING,SIMPLEX,MULTICAST> mtu 1500
> 	options=400<CHANNEL_IO>
> 	ether 56:d4:87:cd:ea:5a
> 	nd6 options=201<PERFORMNUD,DAD>
> 	media: none
> 	status: inactive
> en5: flags=8863<UP,BROADCAST,SMART,RUNNING,SIMPLEX,MULTICAST> mtu 1500
> 	options=400<CHANNEL_IO>
> 	ether 56:d4:87:cd:ea:5b
> 	nd6 options=201<PERFORMNUD,DAD>
> 	media: none
> 	status: inactive
> en2: flags=8963<UP,BROADCAST,SMART,RUNNING,PROMISC,SIMPLEX,MULTICAST> mtu 1500
> 	options=460<TSO4,TSO6,CHANNEL_IO>
> 	ether 36:fb:0b:de:25:c0
> 	media: autoselect <full-duplex>
> 	status: inactive
> en3: flags=8963<UP,BROADCAST,SMART,RUNNING,PROMISC,SIMPLEX,MULTICAST> mtu 1500
> 	options=460<TSO4,TSO6,CHANNEL_IO>
> 	ether 36:fb:0b:de:25:c4
> 	media: autoselect <full-duplex>
> 	status: inactive
> ap1: flags=8863<UP,BROADCAST,SMART,RUNNING,SIMPLEX,MULTICAST> mtu 1500
> 	options=6460<TSO4,TSO6,CHANNEL_IO,PARTIAL_CSUM,ZEROINVERT_CSUM>
> 	ether 4a:fe:62:4a:66:d4
> 	nd6 options=201<PERFORMNUD,DAD>
> 	media: autoselect (none)
> 	status: inactive
> en1: flags=8863<UP,BROADCAST,SMART,RUNNING,SIMPLEX,MULTICAST> mtu 1500
> 	options=6460<TSO4,TSO6,CHANNEL_IO,PARTIAL_CSUM,ZEROINVERT_CSUM>
> 	ether 5e:05:3f:ea:f4:89
> 	inet6 fe80::1413:2ef3:8a26:bbfe%en1 prefixlen 64 secured scopeid 0xc 
> 	nd6 options=201<PERFORMNUD,DAD>
> 	media: autoselect (none)
> bridge0: flags=8863<UP,BROADCAST,SMART,RUNNING,SIMPLEX,MULTICAST> mtu 1500
> 	options=63<RXCSUM,TXCSUM,TSO4,TSO6>
> 	ether 36:fb:0b:de:25:c0
> 	Configuration:
> 		id 0:0:0:0:0:0 priority 0 hellotime 0 fwddelay 0
> 		maxage 0 holdcnt 0 proto stp maxaddr 100 timeout 1200
> 		root id 0:0:0:0:0:0 priority 0 ifcost 0 port 0
> 		ipfilter disabled flags 0x0
> 	member: en2 flags=3<LEARNING,DISCOVER>
> 	        ifmaxaddr 0 port 9 priority 0 path cost 0
> 	member: en3 flags=3<LEARNING,DISCOVER>
> 	        ifmaxaddr 0 port 10 priority 0 path cost 0
> 	nd6 options=201<PERFORMNUD,DAD>
> 	media: <unknown type>
> 	status: inactive
> awdl0: flags=8822<BROADCAST,SMART,SIMPLEX,MULTICAST> mtu 1500
> 	options=400<CHANNEL_IO>
> 	ether 7a:70:da:de:2b:f5
> 	media: autoselect (none)
> llw0: flags=8863<UP,BROADCAST,SMART,RUNNING,SIMPLEX,MULTICAST> mtu 1500
> 	options=400<CHANNEL_IO>
> 	ether 7a:70:da:de:2b:f5
> 	inet6 fe80::7870:daff:fede:2bf5%llw0 prefixlen 64 scopeid 0xf 
> 	nd6 options=201<PERFORMNUD,DAD>
> 	media: autoselect (none)
```

**Comment by St3ll4rM4n** [comment]
Enabled WiFi en1 interface. Changed config to bind to it. According to logs, it binds correctly, but still SSDP packages are not being sent.

Also tried to do tcpdump on "any" interface to check if from some reason it sends packets on other interface. Nope. Still can't see them going.

> sudo tcpdump -i any udp port 1900 -n

**Comment by KarlStraussberger** [comment]
For broadcasting to work properly libupnp under Linux it needs

```
route add -net 239.0.0.0 netmask 255.0.0.0 en0
ifconfig en0 allmulti 
```

Is there something similary for macos?

**Comment by St3ll4rM4n** [comment]
I have the following routing table.

> admin@MyMacServer ~ % sudo netstat -nr 
> Routing tables
> 
```
> Internet:
> Destination        Gateway            Flags               Netif Expire
> default            192.168.1.254      UGScg                 en0       
> 127                127.0.0.1          UCS                   lo0       
> 127.0.0.1          127.0.0.1          UH                    lo0       
> 169.254            link#6             UCS                   en0      !
> 169.254.240.64     70:1a:b8:e6:7d:6e  UHLSW                 en0      !
> 192.168.1          link#6             UCS                   en0      !
> 192.168.1.1/32     link#6             UCS                   en0      !
> 192.168.1.1        14:98:77:48:c4:9   UHLWI                 lo0       
> 192.168.1.11       0:6:78:9b:57:78    UHLWI                 en0   1065
> 192.168.1.50       24:5a:4c:5f:17:b4  UHLWIi                en0   1184
> 192.168.1.116      96:4d:7d:c5:58:b5  UHLWIi                en0   1135
> 192.168.1.146      94:ea:32:64:e1:ab  UHLWI                 en0   1155
> 192.168.1.153      9c:6b:0:5:d9:4c    UHLWI                 en0    312
> 192.168.1.174      9a:8b:a0:92:55:dd  UHLWI                 en0      8
> 192.168.1.184      62:17:49:5b:67:b0  UHLWI                 en0      !
> 192.168.1.195      7a:c0:cb:33:ae:c1  UHLWI                 en0   1172
> 192.168.1.254/32   link#6             UCS                   en0      !
> 192.168.1.254      74:ac:b9:a8:47:b7  UHLWIir               en0   1197
> 192.168.1.255      ff:ff:ff:ff:ff:ff  UHLWbI                en0      !
> 224.0.0/4          link#6             UmCS                  en0      !
> 224.0.0.251        1:0:5e:0:0:fb      UHmLWI                en0       
> 239.255.255.250    1:0:5e:7f:ff:fa    UHmLWI                en0       
> 255.255.255.255/32 link#6             UCS                   en0      !
> 
> Internet6:
> Destination                             Gateway                                 Flags               Netif Expire
> ::1                                     ::1                                     UHL                   lo0       
> fd46:489f:7d8::/64                      fe80::6f:fce3:983:ec6d%en0              UGc                   en0       
> fdf9:b82e:519d:a34d::/64                link#6                                  UC                    en0       
> fdf9:b82e:519d:a34d:88e:1cfc:8b43:b83e  62:17:49:5b:67:b0                       UHLWI                 en0       
> fdf9:b82e:519d:a34d:182d:bea1:6e91:2f72 14:98:77:48:c4:9                        UHL                   lo0       
> fe80::%lo0/64                           fe80::1%lo0                             UcI                   lo0       
> fe80::1%lo0                             link#1                                  UHLI                  lo0       
> fe80::%en0/64                           link#6                                  UCI                   en0       
> fe80::6f:fce3:983:ec6d%en0              94:ea:32:64:e1:ab                       UHLWI                 en0       
> fe80::44c:d996:1d21:9826%en0            72:5:b:1e:f6:a                          UHLWI                 en0       
> fe80::8d9:73f8:d627:c726%en0            14:98:77:48:c4:9                        UHLI                  lo0       
> fe80::%awdl0/64                         link#14                                 UCI                 awdl0       
> fe80::7870:daff:fede:2bf5%awdl0         7a:70:da:de:2b:f5                       UHLI                  lo0       
> fe80::7870:daff:fede:2bf5%llw0          7a:70:da:de:2b:f5                       UHLI                  lo0       
> ff00::/8                                ::1                                     UmCI                  lo0       
> ff00::/8                                link#6                                  UmCI                  en0       
> ff00::/8                                link#12                                 UmCI                  en1       
> ff00::/8                                link#14                                 UmCI                awdl0       
> ff00::/8                                link#15                                 UmCI                 llw0       
> ff01::%lo0/32                           ::1                                     UmCI                  lo0       
> ff01::%en0/32                           link#6                                  UmCI                  en0       
> ff01::%en1/32                           link#12                                 UmCI                  en1       
> ff01::%awdl0/32                         link#14                                 UmCI                awdl0       
> ff02::%lo0/32                           ::1                                     UmCI                  lo0       
> ff02::%en0/32                           link#6                                  UmCI                  en0       
> ff02::%en1/32                           link#12                                 UmCI                  en1       
> ff02::%awdl0/32                         link#14                                 UmCI                awdl0       
```

Ifconfig shows multicast is enabled.

> admin@MyMacServer ~ % ifconfig en0
```
> en0: flags=8863<UP,BROADCAST,SMART,RUNNING,SIMPLEX,MULTICAST> mtu 1500
> 	options=50b<RXCSUM,TXCSUM,VLAN_HWTAGGING,AV,CHANNEL_IO>
> 	ether 14:98:77:48:c4:09
> 	inet6 fe80::8d9:73f8:d627:c726%en0 prefixlen 64 secured scopeid 0x6 
> 	inet6 fdf9:b82e:519d:a34d:182d:bea1:6e91:2f72 prefixlen 64 autoconf secured 
> 	inet 192.168.1.1 netmask 0xffffff00 broadcast 192.168.1.255
> 	nd6 options=201<PERFORMNUD,DAD>
> 	media: autoselect (1000baseT <full-duplex,flow-control,energy-efficient-ethernet>)
> 	status: active
```

... and as I mentioned, it works fine with minidlna with the same settings.

**Comment by KarlStraussberger** [comment]
It should be `239.0.0.0` instead of `239.255.255.250`.

Minidlna has a very basic network implementation which is neglecting most sanity checks.

LibPUPnP is a very strict to avoid security issues. That's the price of implementing a library. I could not find a tab for npupnp which has more options.

**Comment by St3ll4rM4n** [comment]
I tried the following with no luck. Still there is no SSDP broadcast from gerbera.

```
admin@MyMacServer ~ % sudo route -nv add -host 239.0.0.0 -interface en0   
u: inet 239.0.0.0; u: link en0:14.98.77.48.c4.9; u: inet 255.0.0.0; RTM_ADD: Add Route: len 136, pid: 0, seq 1, errno 0, flags:<UP,STATIC>
locks:  inits: 
sockaddrs: <DST,GATEWAY,NETMASK>
 239.0.0.0 index: 6 en0:14.98.77.48.c4.9 255.0.0.0
add net 239.0.0.0: gateway en0
admin@MyMacServer ~ % sudo netstat -nr -f inet                        
Routing tables

Internet:
Destination        Gateway            Flags               Netif Expire
default            192.168.1.254      UGScg                 en0       
127                127.0.0.1          UCS                   lo0       
127.0.0.1          127.0.0.1          UH                    lo0       
169.254            link#6             UCS                   en0      !
169.254.240.64     70:1a:b8:e6:7d:6e  UHLSW                 en0      !
192.168.1          link#6             UCS                   en0      !
192.168.1.1/32     link#6             UCS                   en0      !
192.168.1.1        14:98:77:48:c4:9   UHLWI                 lo0       
192.168.1.11       0:6:78:9b:57:78    UHLWI                 en0   1054
192.168.1.50       24:5a:4c:5f:17:b4  UHLWIi                en0   1171
192.168.1.116      96:4d:7d:c5:58:b5  UHLWIi                en0   1149
192.168.1.146      94:ea:32:64:e1:ab  UHLWI                 en0    832
192.168.1.153      9c:6b:0:5:d9:4c    UHLWI                 en0      !
192.168.1.174      9a:8b:a0:92:55:dd  UHLWI                 en0    528
192.168.1.184      62:17:49:5b:67:b0  UHLWI                 en0     66
192.168.1.195      7a:c0:cb:33:ae:c1  UHLWI                 en0    555
192.168.1.254/32   link#6             UCS                   en0      !
192.168.1.254      74:ac:b9:a8:47:b7  UHLWIir               en0   1188
192.168.1.255      ff:ff:ff:ff:ff:ff  UHLWbI                en0      !
224.0.0/4          link#6             UmCS                  en0      !
224.0.0.251        1:0:5e:0:0:fb      UHmLWI                en0       
239.0.0.0          1:0:5e:0:0:0       UHmLS                 en0    
255.255.255.255/32 link#6             UCS                   en0      !
```

**Comment by KarlStraussberger** [comment]
Did you try `route add -net 239.0.0.0/8 -interface en0`

**Comment by St3ll4rM4n** [comment]
No difference

**Comment by KarlStraussberger** [comment]
I'm running out of ideas.

Upnp is build without `--enable-reuseaddr` and `--disable-blocking-tcp-connections` in  https://github.com/Homebrew/homebrew-core/blob/c6e0f7ef85b049b16fc045fea57c702289355a8b/Formula%2Flib%2Flibupnp.rb

Also IPv6 may cause some trouble.

**Comment by KarlStraussberger** [comment]
@mrjimenez any idea on this issue regarding MacOS?

**Comment by mrjimenez** [comment]
Hi,

I was not aware of this issue. The following might be the suspects:

- In 2025-06-10 there was one commit that touched SSDP:
https://github.com/pupnp/pupnp/commit/8d18ddf058e41c046c39d0ecaa921d8c5ccc121f
- In 2025-06-07 there was one commit that touched SSDP: https://github.com/pupnp/pupnp/commit/b8018e78378f7f2fe76d05269c743f596dde78a7
- In 2025-04-14, there have been two commits in libupnp that have a relation with advertising. They are https://github.com/pupnp/pupnp/commit/770b9d194344a59c4b1a51f8567cba68afeb8876 and https://github.com/pupnp/pupnp/commit/52cb6b52d2b914ad37eec142bc2eb677a124eda5.

@St3ll4rM4n , is it possible for you to run with libupnp releases 1.14.20 to 1.14.24? Or even better, do a git bisect?

Regards,
Marcelo.

**Comment by KarlStraussberger** [comment]
@mrjimenez I think that `getaddrinfo` returns a list of addresses and the code only sends to the first. In case of macos the result may differ from linux and the response go through the wrong interface

https://github.com/pupnp/pupnp/commit/52cb6b52d2b914ad37eec142bc2eb677a124eda5

**Comment by KarlStraussberger** [comment]
According to getaddrinfo(3) - Linux manual page https://share.google/cZcbCco8NZ3lkGVFU there is also `freeaddrinfo(result)` to be called.

**Comment by St3ll4rM4n** [comment]
In default brew installation libupnp in version 1.14.24 (at the moment of testing) - this doesn't work.

I installed 1.14.20 as suggested and compiled gerbera 2.6.1 as typical I do using "brew install gerbera" option. Actually after a slight modifications as I had to create my local tap for both libupnp version 1.14.20 and recent gerbera.

It works! SSDP packets are sent and Gerbera is again visible on my Samsung TV.

```
tcpdump: verbose output suppressed, use -v[v]... for full protocol decode
listening on en0, link-type EN10MB (Ethernet), snapshot length 524288 bytes
20:45:01.039489 IP 192.168.1.11.49645 > 239.255.255.250.1900: UDP, length 667
20:45:11.135208 IP 192.168.1.153.51560 > 239.255.255.250.1900: UDP, length 125
**20:45:12.291576 IP 192.168.1.1.63559 > 239.255.255.250.1900: UDP, length 428
20:45:12.291578 IP 192.168.1.1.63559 > 239.255.255.250.1900: UDP, length 437
20:45:12.291579 IP 192.168.1.1.63559 > 239.255.255.250.1900: UDP, length 480
20:45:12.291735 IP 192.168.1.1.62014 > 239.255.255.250.1900: UDP, length 494
20:45:12.291737 IP 192.168.1.1.65494 > 239.255.255.250.1900: UDP, length 492
20:45:12.291744 IP 192.168.1.1.61232 > 239.255.255.250.1900: UDP, length 508**
```

However I sometimes see the following error messages in the log

```
2025-09-09 18:46:35   info: Initialising UPnP with interface: en0, port: 49152
2025-09-09 18:46:35 warning: UPnP Init en0:49152 failed: UPNP_E_INVALID_INTERFACE (-121). Retrying in 1 seconds...
2025-09-09 18:46:36 warning: UPnP Init en0:49152 failed: UPNP_E_OUTOF_SOCKET (-205). Retrying in 2 seconds...
2025-09-09 18:46:38   info: IPv4: Server bound to: 192.168.1.1:49152
2025-09-09 18:46:38   info: IPv6: Server bound to: fe80::1cc0:dfd5:3e9a:7381:49152
```

@mrjimenez FYI

**Comment by KarlStraussberger** [comment]
Can you try https://github.com/KarlStraussberger/pupnp/tree/patch-1 as well.

Thanks for supporting us.

**Comment by KarlStraussberger** [comment]
@St3ll4rM4n Now it's available in https://github.com/pupnp/pupnp

**Comment by mrjimenez** [comment]
If it works, please tell me so that I can release it ASAP.

**Comment by St3ll4rM4n** [comment]
Thanks. No, it doesn't work with those patches. I use the following .rb file to compile and install. Am I missing something, or the patch just don't work?

```
class Libupnp < Formula
  desc "Portable UPnP development kit"
  homepage "https://pupnp.sourceforge.io/"
  url "https://github.com/pupnp/pupnp/archive/refs/heads/branch-1.14.x.zip"
  version "1.14.x"
 sha256 "5a6938336633dbdc2fa37729ec81a0e98383630afea3aff152605f3fd9880993" 

  license "BSD-3-Clause"

  depends_on "autoconf" => :build
  depends_on "automake" => :build
  depends_on "libtool"  => :build
  depends_on "pkg-config" => :build

  def install
    system "./bootstrap" if File.exist?("bootstrap")
    args = %W[
      --disable-debug
      --disable-dependency-tracking
      --prefix=#{prefix}
      --enable-ipv6
    ]

    system "./configure", *args
    system "make"
    system "make", "install"
  end
end

```

**Comment by KarlStraussberger** [comment]
@mrjimenez What do you think of using `SO_REUSEPORT` in

```
        rc = setsockopt(ReplySock,
                SOL_SOCKET,
                SO_REUSEADDR,
                (OPTION_VALUE_CAST)&yes,
                sizeof yes);
```

**Comment by KarlStraussberger** [comment]
@St3ll4rM4n Can you check out the clients page on web ui. It will tell ous whether gerbera/libupnp sees the clients at all.

**Comment by St3ll4rM4n** [comment]
Gerbera 2.6.1
libupnp 1.14.24

No SSDP being sent. Gerbera not visible on network/Samsung TV.

Clients tab:

```
IP Address
Host Name
Group	User Agent	Profile
Match Type
Match Pattern	Client Type	First Seen
Last Seen	Client Flags	Action
192.168.1.1
mymacserver
default	Darwin/24.6.0, UPnP/1.0, Portable SDK for UPnP devices/1.14.24	Standard UPnP
UserAgent
UPnP/1.0	StandardUPnP	Sun Sep 14 11:21:41 2025
Sun Sep 14 11:21:41 2025	None	
192.168.1.11
denon-avc-s660h
default	LINUX UPnP/1.0 Denon-Heos/2fb7048f040e2d231d6068253db0ed1eb639d1b8	Standard UPnP
UserAgent
UPnP/1.0	StandardUPnP	Sun Sep 14 11:22:00 2025
Sun Sep 14 11:22:00 2025	None	
192.168.1.185
192.168.1.185
default	Mozilla/5.0 (Macintosh; Intel Mac OS X 10_15_7) AppleWebKit/605.1.15 (KHTML, like Gecko) Version/18.6 Safari/605.1.15	Unknown
None
None	Sun Sep 14 11:21:59 2025
Sun Sep 14 11:21:59 2025	None	
No Groups found
```

**Comment by KarlStraussberger** [comment]
@St3ll4rM4n Do you mind trying the new PRs changes? 
https://github.com/KarlStraussberger/pupnp/tree/KarlStraussberger-patch-1

**Comment by St3ll4rM4n** [comment]
Gerbera 2.6.1
libupnp KarlStraussberger-patch-1.zip

It works. SSDP are being sent!. Gerbera is visible on network/Samsung TV.

```
2025-09-15 18:35:56   info: Configuration check succeeded.
2025-09-15 18:35:56   info: Loading 0 configuration items from database
2025-09-15 18:35:56   info: Initialising UPnP with interface: en0, port: 49152
2025-09-15 18:35:56   info: IPv4: Server bound to: 192.168.1.1:49152
2025-09-15 18:35:56   info: IPv6: Server bound to: fe80::1cc0:dfd5:3e9a:7381:49152
2025-09-15 18:35:56   info: IPv6 ULA/GLA: Server bound to: fdf9:b82e:519d:a34d:182d:bea1:6e91:2f72:49152
2025-09-15 18:35:56   info: The Web UI can be reached by following this link: http://192.168.1.1:49152
```

libupnp.rb lines
```
url "https://github.com/KarlStraussberger/pupnp/archive/refs/heads/KarlStraussberger-patch-1.zip"
sha256 "b11643dbe5c585c27d993ada8f42acadc3c775897efff84ef8c3a51c7713296c"
```

**Comment by KarlStraussberger** [comment]
That was quick. Many thanks sent out of Dublin

@mrjimenez You can merge and release it

**Comment by mrjimenez** [comment]
> That was quick. Many thanks sent out of Dublin
> 
> [@mrjimenez](https://github.com/mrjimenez) You can merge and release it

Sure! I've merged it, I will release soon, hopefully by the end of the day.

Thank you for all the support.
