### DISCUSSION TITLE
Gerbera in a docker container: access from a computer on local network

### DISCUSSION THREAD

**Discussion by cmigliorini** [gerbera/gerbera#3760] [Q&A]
Hello, I was able to run Gerbera in a container, and to have it successfully broadcast (multicast) and respond to discoveries (multicast, too) but it will not respond to requests from a different host

- TCP SYN packets from VLC running on a different computer on the same local network never get a response 
- curl requests to the webserver work from the server, not from the distant computer... instead I get errno 113 "no route to host" (!!)

I do NOT have a firewall setup.

I have two computers, both in 192.168.1.0/24. Between them, a WiFi access point, a switch, PLC and another switch (server is wired). 

Does this ring a bell to someone?

**Comment by cmigliorini** [comment]
Some dumps : I started VLC shortly after `tcpdump`. As you can see, server receives the packets... Gerbera does not, even though it is bound to 192.168.1.252, and to fe80::5663:5c9f:7629:4863, although it seems to only advertise IPV4 addresses:
```
LOCATION: http://192.168.1.252:49152/upnp/description.xml
```

## Client 192.168.1.87
```log
client:~$ sudo tcpdump port 1900 or port 49152 -nn
dropped privs to tcpdump
tcpdump: verbose output suppressed, use -v[v]... for full protocol decode
listening on wlp2s0, link-type EN10MB (Ethernet), snapshot length 262144 bytes
21:49:24.790651 IP6 2a01:...:c5a0.37858 > ff05::c.1900: UDP, length 121
21:49:24.890884 IP6 2a01:...:c5a0.37858 > ff05::c.1900: UDP, length 121
21:49:24.991131 IP6 fe80::5663:5c9f:7629:4863.37858 > ff02::c.1900: UDP, length 121
21:49:25.091411 IP6 fe80::5663:5c9f:7629:4863.37858 > ff02::c.1900: UDP, length 121
21:49:25.191623 IP 192.168.1.87.43489 > 239.255.255.250.1900: UDP, length 127
21:49:25.198656 IP 192.168.1.252.1900 > 192.168.1.87.43489: UDP, length 494
21:49:25.199155 IP 192.168.1.87.38486 > 192.168.1.252.49152: Flags [S], seq 2445722845, win 64240, options [mss 1460,sackOK,TS val 273836456 ecr 0,nop,wscale 10], length 0
21:49:25.291812 IP 192.168.1.87.43489 > 239.255.255.250.1900: UDP, length 127
21:49:25.392153 IP6 2a01:...:c5a0.37858 > ff05::c.1900: UDP, length 112
21:49:25.492408 IP6 2a01:...:c5a0.37858 > ff05::c.1900: UDP, length 112
21:49:25.592715 IP6 fe80::5663:5c9f:7629:4863.37858 > ff02::c.1900: UDP, length 112
21:49:25.692997 IP6 fe80::5663:5c9f:7629:4863.37858 > ff02::c.1900: UDP, length 112
21:49:25.793300 IP 192.168.1.87.43489 > 239.255.255.250.1900: UDP, length 118
21:49:25.893542 IP 192.168.1.87.43489 > 239.255.255.250.1900: UDP, length 118
21:49:28.000079 IP 192.168.1.252.1900 > 192.168.1.87.43489: UDP, length 494
21:49:28.000734 IP 192.168.1.87.38494 > 192.168.1.252.49152: Flags [S], seq 3278816600, win 64240, options [mss 1460,sackOK,TS val 273839258 ecr 0,nop,wscale 10], length 0
21:49:55.317442 IP 192.168.1.252.1900 > 239.255.255.250.1900: UDP, length 446
21:49:55.317444 IP 192.168.1.252.1900 > 239.255.255.250.1900: UDP, length 455
21:49:55.318169 IP 192.168.1.87.44030 > 192.168.1.252.49152: Flags [S], seq 4052163338, win 64240, options [mss 1460,sackOK,TS val 273866575 ecr 0,nop,wscale 10], length 0
21:49:55.318210 IP 192.168.1.87.44032 > 192.168.1.252.49152: Flags [S], seq 63793912, win 64240, options [mss 1460,sackOK,TS val 273866575 ecr 0,nop,wscale 10], length 0
21:49:55.318725 IP 192.168.1.252.1900 > 239.255.255.250.1900: UDP, length 498
21:49:55.319179 IP 192.168.1.87.44052 > 192.168.1.252.49152: Flags [S], seq 587666800, win 64240, options [mss 1460,sackOK,TS val 273866576 ecr 0,nop,wscale 10], length 0
21:49:55.320966 IP 192.168.1.252.1900 > 239.255.255.250.1900: UDP, length 512
21:49:55.321449 IP 192.168.1.87.44060 > 192.168.1.252.49152: Flags [S], seq 2481232380, win 64240, options [mss 1460,sackOK,TS val 273866579 ecr 0,nop,wscale 10], length 0
21:49:55.322186 IP 192.168.1.252.1900 > 239.255.255.250.1900: UDP, length 510
21:49:55.322188 IP 192.168.1.252.1900 > 239.255.255.250.1900: UDP, length 526
21:49:55.322513 IP 192.168.1.87.44070 > 192.168.1.252.49152: Flags [S], seq 3428576189, win 64240, options [mss 1460,sackOK,TS val 273866580 ecr 0,nop,wscale 10], length 0
21:49:55.322662 IP 192.168.1.87.44076 > 192.168.1.252.49152: Flags [S], seq 2512879555, win 64240, options [mss 1460,sackOK,TS val 273866580 ecr 0,nop,wscale 10], length 0
21:49:55.323155 IP 192.168.1.252.1900 > 239.255.255.250.1900: UDP, length 455
21:49:55.323495 IP 192.168.1.87.44090 > 192.168.1.252.49152: Flags [S], seq 3220424862, win 64240, options [mss 1460,sackOK,TS val 273866581 ecr 0,nop,wscale 10], length 0
21:49:55.324148 IP 192.168.1.252.1900 > 239.255.255.250.1900: UDP, length 498
21:49:55.324470 IP 192.168.1.87.44094 > 192.168.1.252.49152: Flags [S], seq 3268564541, win 64240, options [mss 1460,sackOK,TS val 273866582 ecr 0,nop,wscale 10], length 0
21:49:55.324832 IP 192.168.1.252.1900 > 239.255.255.250.1900: UDP, length 512
21:49:55.325169 IP 192.168.1.87.44106 > 192.168.1.252.49152: Flags [S], seq 1671979324, win 64240, options [mss 1460,sackOK,TS val 273866582 ecr 0,nop,wscale 10], length 0
21:49:55.325571 IP 192.168.1.252.1900 > 239.255.255.250.1900: UDP, length 510
21:49:55.325878 IP 192.168.1.87.44110 > 192.168.1.252.49152: Flags [S], seq 4238781013, win 64240, options [mss 1460,sackOK,TS val 273866583 ecr 0,nop,wscale 10], length 0
21:49:55.327402 IP 192.168.1.252.1900 > 239.255.255.250.1900: UDP, length 526
21:49:55.327719 IP 192.168.1.87.44118 > 192.168.1.252.49152: Flags [S], seq 2283459892, win 64240, options [mss 1460,sackOK,TS val 273866585 ecr 0,nop,wscale 10], length 0
21:49:56.359463 IP 192.168.1.87.44090 > 192.168.1.252.49152: Flags [S], seq 3220424862, win 64240, options [mss 1460,sackOK,TS val 273867617 ecr 0,nop,wscale 10], length 0
21:49:56.359501 IP 192.168.1.87.44110 > 192.168.1.252.49152: Flags [S], seq 4238781013, win 64240, options [mss 1460,sackOK,TS val 273867617 ecr 0,nop,wscale 10], length 0
21:49:56.359520 IP 192.168.1.87.44118 > 192.168.1.252.49152: Flags [S], seq 2283459892, win 64240, options [mss 1460,sackOK,TS val 273867617 ecr 0,nop,wscale 10], length 0
21:49:56.359532 IP 192.168.1.87.44094 > 192.168.1.252.49152: Flags [S], seq 3268564541, win 64240, options [mss 1460,sackOK,TS val 273867617 ecr 0,nop,wscale 10], length 0
21:49:56.359542 IP 192.168.1.87.44106 > 192.168.1.252.49152: Flags [S], seq 1671979324, win 64240, options [mss 1460,sackOK,TS val 273867617 ecr 0,nop,wscale 10], length 0
21:49:57.383302 IP 192.168.1.87.44118 > 192.168.1.252.49152: Flags [S], seq 2283459892, win 64240, options [mss 1460,sackOK,TS val 273868641 ecr 0,nop,wscale 10], length 0
21:49:57.383342 IP 192.168.1.87.44110 > 192.168.1.252.49152: Flags [S], seq 4238781013, win 64240, options [mss 1460,sackOK,TS val 273868641 ecr 0,nop,wscale 10], length 0
21:49:57.383380 IP 192.168.1.87.44094 > 192.168.1.252.49152: Flags [S], seq 3268564541, win 64240, options [mss 1460,sackOK,TS val 273868641 ecr 0,nop,wscale 10], length 0
21:49:57.383403 IP 192.168.1.87.44106 > 192.168.1.252.49152: Flags [S], seq 1671979324, win 64240, options [mss 1460,sackOK,TS val 273868641 ecr 0,nop,wscale 10], length 0
21:49:58.407286 IP 192.168.1.87.44094 > 192.168.1.252.49152: Flags [S], seq 3268564541, win 64240, options [mss 1460,sackOK,TS val 273869665 ecr 0,nop,wscale 10], length 0
21:49:58.407319 IP 192.168.1.87.44110 > 192.168.1.252.49152: Flags [S], seq 4238781013, win 64240, options [mss 1460,sackOK,TS val 273869665 ecr 0,nop,wscale 10], length 0
21:49:58.408243 IP 192.168.1.87.44106 > 192.168.1.252.49152: Flags [S], seq 1671979324, win 64240, options [mss 1460,sackOK,TS val 273869666 ecr 0,nop,wscale 10], length 0
21:49:59.431291 IP 192.168.1.87.44106 > 192.168.1.252.49152: Flags [S], seq 1671979324, win 64240, options [mss 1460,sackOK,TS val 273870689 ecr 0,nop,wscale 10], length 0
21:49:59.431325 IP 192.168.1.87.44110 > 192.168.1.252.49152: Flags [S], seq 4238781013, win 64240, options [mss 1460,sackOK,TS val 273870689 ecr 0,nop,wscale 10], length 0
21:50:00.455275 IP 192.168.1.87.44110 > 192.168.1.252.49152: Flags [S], seq 4238781013, win 64240, options [mss 1460,sackOK,TS val 273871713 ecr 0,nop,wscale 10], length 0
```
## Server 192.168.1.252
```log
server:~/$ sudo tcpdump port 1900 or port 49152 -nn
dropped privs to tcpdump
tcpdump: verbose output suppressed, use -v[v]... for full protocol decode
listening on enp2s0, link-type EN10MB (Ethernet), snapshot length 262144 bytes
21:49:24.803673 IP6 2a01:...:c5a0.37858 > ff05::c.1900: UDP, length 121
21:49:24.897174 IP6 2a01:...:c5a0.37858 > ff05::c.1900: UDP, length 121
21:49:24.997462 IP6 fe80::5663:5c9f:7629:4863.37858 > ff02::c.1900: UDP, length 121
21:49:25.097962 IP6 fe80::5663:5c9f:7629:4863.37858 > ff02::c.1900: UDP, length 121
21:49:25.197700 IP 192.168.1.87.43489 > 239.255.255.250.1900: UDP, length 127
21:49:25.199216 IP 192.168.1.252.1900 > 192.168.1.87.43489: UDP, length 494
21:49:25.204831 IP 192.168.1.87.38486 > 192.168.1.252.49152: Flags [S], seq 2445722845, win 64240, options [mss 1460,sackOK,TS val 273836456 ecr 0,nop,wscale 10], length 0
21:49:25.298029 IP 192.168.1.87.43489 > 239.255.255.250.1900: UDP, length 127
21:49:25.398394 IP6 2a01:...:c5a0.37858 > ff05::c.1900: UDP, length 112
21:49:25.498516 IP6 2a01:...:c5a0.37858 > ff05::c.1900: UDP, length 112
21:49:25.598747 IP6 fe80::5663:5c9f:7629:4863.37858 > ff02::c.1900: UDP, length 112
21:49:25.699206 IP6 fe80::5663:5c9f:7629:4863.37858 > ff02::c.1900: UDP, length 112
21:49:25.799591 IP 192.168.1.87.43489 > 239.255.255.250.1900: UDP, length 118
21:49:25.899575 IP 192.168.1.87.43489 > 239.255.255.250.1900: UDP, length 118
21:49:28.000291 IP 192.168.1.252.1900 > 192.168.1.87.43489: UDP, length 494
21:49:28.007578 IP 192.168.1.87.38494 > 192.168.1.252.49152: Flags [S], seq 3278816600, win 64240, options [mss 1460,sackOK,TS val 273839258 ecr 0,nop,wscale 10], length 0
21:49:55.000279 IP 192.168.1.252.1900 > 239.255.255.250.1900: UDP, length 446
21:49:55.000302 IP 192.168.1.252.1900 > 239.255.255.250.1900: UDP, length 455
21:49:55.000310 IP 192.168.1.252.1900 > 239.255.255.250.1900: UDP, length 498
21:49:55.000339 IP 192.168.1.252.1900 > 239.255.255.250.1900: UDP, length 512
21:49:55.000359 IP 192.168.1.252.1900 > 239.255.255.250.1900: UDP, length 510
21:49:55.000391 IP 192.168.1.252.1900 > 239.255.255.250.1900: UDP, length 526
21:49:55.101162 IP 192.168.1.252.1900 > 239.255.255.250.1900: UDP, length 446
21:49:55.101181 IP 192.168.1.252.1900 > 239.255.255.250.1900: UDP, length 455
21:49:55.101189 IP 192.168.1.252.1900 > 239.255.255.250.1900: UDP, length 498
21:49:55.102129 IP 192.168.1.252.1900 > 239.255.255.250.1900: UDP, length 512
21:49:55.102162 IP 192.168.1.252.1900 > 239.255.255.250.1900: UDP, length 510
21:49:55.102183 IP 192.168.1.252.1900 > 239.255.255.250.1900: UDP, length 526
21:49:55.332883 IP 192.168.1.87.44030 > 192.168.1.252.49152: Flags [S], seq 4052163338, win 64240, options [mss 1460,sackOK,TS val 273866575 ecr 0,nop,wscale 10], length 0
21:49:55.332884 IP 192.168.1.87.44032 > 192.168.1.252.49152: Flags [S], seq 63793912, win 64240, options [mss 1460,sackOK,TS val 273866575 ecr 0,nop,wscale 10], length 0
21:49:55.332884 IP 192.168.1.87.44052 > 192.168.1.252.49152: Flags [S], seq 587666800, win 64240, options [mss 1460,sackOK,TS val 273866576 ecr 0,nop,wscale 10], length 0
21:49:55.332884 IP 192.168.1.87.44060 > 192.168.1.252.49152: Flags [S], seq 2481232380, win 64240, options [mss 1460,sackOK,TS val 273866579 ecr 0,nop,wscale 10], length 0
21:49:55.332884 IP 192.168.1.87.44070 > 192.168.1.252.49152: Flags [S], seq 3428576189, win 64240, options [mss 1460,sackOK,TS val 273866580 ecr 0,nop,wscale 10], length 0
21:49:55.332884 IP 192.168.1.87.44076 > 192.168.1.252.49152: Flags [S], seq 2512879555, win 64240, options [mss 1460,sackOK,TS val 273866580 ecr 0,nop,wscale 10], length 0
21:49:55.333668 IP 192.168.1.87.44090 > 192.168.1.252.49152: Flags [S], seq 3220424862, win 64240, options [mss 1460,sackOK,TS val 273866581 ecr 0,nop,wscale 10], length 0
21:49:55.333669 IP 192.168.1.87.44094 > 192.168.1.252.49152: Flags [S], seq 3268564541, win 64240, options [mss 1460,sackOK,TS val 273866582 ecr 0,nop,wscale 10], length 0
21:49:55.333669 IP 192.168.1.87.44106 > 192.168.1.252.49152: Flags [S], seq 1671979324, win 64240, options [mss 1460,sackOK,TS val 273866582 ecr 0,nop,wscale 10], length 0
21:49:55.333669 IP 192.168.1.87.44110 > 192.168.1.252.49152: Flags [S], seq 4238781013, win 64240, options [mss 1460,sackOK,TS val 273866583 ecr 0,nop,wscale 10], length 0
21:49:55.333669 IP 192.168.1.87.44118 > 192.168.1.252.49152: Flags [S], seq 2283459892, win 64240, options [mss 1460,sackOK,TS val 273866585 ecr 0,nop,wscale 10], length 0
21:49:56.366287 IP 192.168.1.87.44090 > 192.168.1.252.49152: Flags [S], seq 3220424862, win 64240, options [mss 1460,sackOK,TS val 273867617 ecr 0,nop,wscale 10], length 0
21:49:56.366288 IP 192.168.1.87.44110 > 192.168.1.252.49152: Flags [S], seq 4238781013, win 64240, options [mss 1460,sackOK,TS val 273867617 ecr 0,nop,wscale 10], length 0
21:49:56.366288 IP 192.168.1.87.44118 > 192.168.1.252.49152: Flags [S], seq 2283459892, win 64240, options [mss 1460,sackOK,TS val 273867617 ecr 0,nop,wscale 10], length 0
21:49:56.366288 IP 192.168.1.87.44094 > 192.168.1.252.49152: Flags [S], seq 3268564541, win 64240, options [mss 1460,sackOK,TS val 273867617 ecr 0,nop,wscale 10], length 0
21:49:56.366289 IP 192.168.1.87.44106 > 192.168.1.252.49152: Flags [S], seq 1671979324, win 64240, options [mss 1460,sackOK,TS val 273867617 ecr 0,nop,wscale 10], length 0
21:49:57.389517 IP 192.168.1.87.44118 > 192.168.1.252.49152: Flags [S], seq 2283459892, win 64240, options [mss 1460,sackOK,TS val 273868641 ecr 0,nop,wscale 10], length 0
21:49:57.389518 IP 192.168.1.87.44110 > 192.168.1.252.49152: Flags [S], seq 4238781013, win 64240, options [mss 1460,sackOK,TS val 273868641 ecr 0,nop,wscale 10], length 0
21:49:57.389518 IP 192.168.1.87.44094 > 192.168.1.252.49152: Flags [S], seq 3268564541, win 64240, options [mss 1460,sackOK,TS val 273868641 ecr 0,nop,wscale 10], length 0
21:49:57.389518 IP 192.168.1.87.44106 > 192.168.1.252.49152: Flags [S], seq 1671979324, win 64240, options [mss 1460,sackOK,TS val 273868641 ecr 0,nop,wscale 10], length 0
21:49:58.413669 IP 192.168.1.87.44094 > 192.168.1.252.49152: Flags [S], seq 3268564541, win 64240, options [mss 1460,sackOK,TS val 273869665 ecr 0,nop,wscale 10], length 0
21:49:58.413670 IP 192.168.1.87.44110 > 192.168.1.252.49152: Flags [S], seq 4238781013, win 64240, options [mss 1460,sackOK,TS val 273869665 ecr 0,nop,wscale 10], length 0
21:49:58.413670 IP 192.168.1.87.44106 > 192.168.1.252.49152: Flags [S], seq 1671979324, win 64240, options [mss 1460,sackOK,TS val 273869666 ecr 0,nop,wscale 10], length 0
21:49:59.437813 IP 192.168.1.87.44106 > 192.168.1.252.49152: Flags [S], seq 1671979324, win 64240, options [mss 1460,sackOK,TS val 273870689 ecr 0,nop,wscale 10], length 0
21:49:59.437813 IP 192.168.1.87.44110 > 192.168.1.252.49152: Flags [S], seq 4238781013, win 64240, options [mss 1460,sackOK,TS val 273870689 ecr 0,nop,wscale 10], length 0
21:50:00.463810 IP 192.168.1.87.44110 > 192.168.1.252.49152: Flags [S], seq 4238781013, win 64240, options [mss 1460,sackOK,TS val 273871713 ecr 0,nop,wscale 10], length 0
```

**Comment by thilo-hub** [comment]
I see a (I think) similar behavior. I run gerbera on a host in the 192.168.0 network.  Requests from the same subnet are working. But when I am on the 192.1.68.3.* subnet, a curl receives "* Recv failure: Connection reset by peer
* Closing connection
curl: (56) Recv failure: Connection reset by peer"
Gerbera shows no info if running with -D  ( gerbera host is a freebsd jail with only ipv4 network enabled. )
verifying the connections by using nc -l 44444 on the gerbera host and connecting from the other subnet works though.

I think this is either an issue in gerbera or its dependencies or maybe the config is wrong. Anyone knows if there is a config setting that by default prevents other subnets from serving?
